### ISSUE TITLE
Issues : Reading UDP stream

### ISSUE THREAD

**Issue by Batistouyouyou** [superkabuki/threefive_is_scte35#12]
Hello, 
Thank you for your project, which is very helpful to me. However, I noticed that the value self.upid_value[“duration”] = hex(int.from_bytes(data[9:11], byteorder="big")) in the Upids.py script is incorrect. The value should be 9:12, not 9:11. 

I am trying to use your library to decode a UDP stream with a source IP (udp://IPSOURCE@MULTICAST:PORT), but I am unable to do so because I always get the following errors when using this code:

udp_data = reader(“udp://@239.1.2.3:1234”)
chunks = [udp_data.read(188) for i in range(0, 1024)]

Here is the console output:
 
    socked.setsockopt(
    ~~~~~~~~~~~~~~~~~^
        socket.SOL_IP,
        ^^^^^^^^^^^^^^
        socket.IP_ADD_MEMBERSHIP,
        ^^^^^^^^^^^^^^^^^^^^^^^^^
        socket.inet_aton(multicast_group) + socket.inet_aton(interface_ip),
        ^^^^^^^^^^^^^^^^^^^^^^^^^^^^^^^^^^^^^^^^^^^^^^^^^^^^^^^^^^^^^^^^^^^
    )
    ^
OSError: [WinError 10022] An invalid argument was supplied

Could you tell me how to use the library in this case? 
Ps: English is not my native language, sorry for any mistakes.

Best regards

**Comment by superkabuki** [comment]
Try this as a test


in one terminal serve a local video that has SCTE-35 with threefive
by default it will use the multicast address udp://@235.35.3.5:3535
```
threefive mcast video.ts
```

open another terminal  and receive the stream with threefive
```
threefive udp://@235.35.3.5:3535
```

it should show the parsed SCTE-35 output

**Comment by superkabuki** [comment]
If your phone is on your wifi network, you can use the vlc app to play the video
click the '+' to add a new stream and enter udp://@235.35.3.5:3535 and the video should play.

**Comment by superkabuki** [comment]
> 
Thank you for your project, which is very helpful to me. However, I noticed that the value self.upid_value[“duration”] = hex(int.from_bytes(data[9:11], byteorder="big")) in the Upids.py script is incorrect. The value should be 9:12, not 9:11.

Which Upid?

**Comment by superkabuki** [comment]
You were right about the Upid, The Addressble TV MPU.

Did the multicast test work for you?
 I am trying to understand the nature of your issue.  

'udp://@MULTICAST:PORT' is the correct format.

 IPSOURCE should Not be used with threefive for multicast.

**Comment by Batistouyouyou** [comment]
Hello, 
Thank you for confirming the Upid, The Addressable TV MPU. 

Regarding multicast, threefive mcast video.ts in a terminal window and then threefive udp://@235.35.3.5:3535 in a second window works very well from the same computer. 

I assume that my problem is related to the fact that the UDP streams I have available are only available with a source IP; they are of the “SSM – Source Specific Multicast” type, which is related to the network architecture. The client sends an IGMP Join (S,G)
(S = source, G = group), so the network only routes the stream coming from this source. This is IGMPv3. 

It seems to me that in the library code, the multicast used is of the “ASM – Any Source Multicast” type. The client sends an IGMP Join (*,G) (* = any source, G = group), which is IGMPv2. 

I'm not 100% sure about what I'm telling you; it's just a guess. 

In my case, I have to specify the Ipsource, which is my problem. It should be noted that I am using Windows OS.
If you say that “IPSOURCE should not be used with threefive for multicast,” then I'm going to be stuck. 

BR

**Comment by superkabuki** [comment]
Honestly, this is the first I've heard of source specific multicast, threefive does not have support for it. 

You can use another tool , and then pipe it to threefive, that will work.

I'll do a new build next week that fixes the upid bug.

I'll look into SSM, but you are the only person that's asked for it, so it's not really a priority. Sorry.

**Comment by superkabuki** [comment]
Actually, it doesn't look that difficult to implement, let me see what happens.....

**Comment by superkabuki** [comment]
What version of python are you using?

**Comment by Batistouyouyou** [comment]
Thank you for the new version with the upid correction. I'm currently using Python 3.14.

**Comment by superkabuki** [comment]
I know English is not your first language and this may be a little confusing.

This way is supposed to work, but it doesn't always work for me. 

[ssmrcv.py](https://github.com/user-attachments/files/25804804/ssmrcv.py)

**Comment by superkabuki** [comment]
Here is an old multicast client that I modified and it seems to work with SSM although

you only need to specify the multicast address



* gumc.py
```
#!/usr/bin/env python3



"""
gumc, Grande Unified Multicast Client

"""


import argparse
import sys
import time
from threefive import reader, Stream

MILLION = 1024 << 10
DGRAM_SIZE = 1316
INSTUFF = "udp://@235.35.3.5:3535"

def func(cue):
    """
    func func to call when we find a SCTE-35 Cue
    """
    cue.show()



class GumC:
    """

    GumC, Grande Unified Multicast Client

    """

    def __init__(self, args):
        self.instuff = args.instuff
        self.rdr = reader(self.instuff)
        self.total_bytes = 0
        self.start_time = None


    def elapsed(self):
        """
        elapsed calculates how long the client has been reading packets.
        """
        return time.time() - self.start_time

    def read(self, num_bites=DGRAM_SIZE):
        """
        read reads num_bites and returns them
        """
        data = b""
        try:
            data = self.rdr.read(num_bites)
        except:
            sys.stderr.write("\n\nTimeout on the socket, no more data available.\n")
            sys.exit()
        return data

    def show_rate(self):
        """
        show_rate shows read rate of gumc.
        """
        elapsed = self.elapsed()
        rate = (self.total_bytes / MILLION) / elapsed
        one = f"\t{self.total_bytes/MILLION:0.2f} MB received in "
        two = f"{elapsed:5.2f} seconds. {rate:3.2f} MB/Sec"
        print(one,two,end="\r",file=sys.stderr)

    def started(self):
        """
        started sets self.start_time if it's not set.
        """
        if not self.start_time:
            self.start_time = time.time()


def argue():
    """
    parse_args parse command line args
    """
    parser = argparse.ArgumentParser()

    parser.add_argument(
        "-i",
        "--instuff",
        default=INSTUFF,
        help="Input, default is 'udp://@235.35.3.5:3535' ",
    )

    return parser.parse_args()


def cli():
    """
    cli  
    """
    args = argue()
    gumc = GumC(args)
    strm=Stream(None)
    while True:
        datagram = gumc.read(DGRAM_SIZE)
        gumc.total_bytes+=len(datagram)
        gumc.started()
        strm._decode2cues(datagram, func)
        gumc.show_rate()


if __name__ == "__main__":
    cli()
```


run this like 

```py3
python gumc.py -i udp://@232.0.0.1:12345
```

I ran  `tcpdump igmp` 
and you can see it joining the group with igmp v3 

```
root@fu:~# tcpdump igmp
tcpdump: verbose output suppressed, use -v[v]... for full protocol decode
listening on wlp2s0, link-type EN10MB (Ethernet), snapshot length 262144 bytes
17:26:30.125824 IP fu.lan > igmp.mcast.net: igmp v3 report, 1 group record(s)
17:26:30.449828 IP fu.lan > igmp.mcast.net: igmp v3 report, 1 group record(s)
17:27:30.193789 IP fu.lan > igmp.mcast.net: igmp v3 report, 1 group record(s)
17:27:31.217829 IP fu.lan > igmp.mcast.net: igmp v3 report, 1 group record(s)
```

**Comment by superkabuki** [comment]
you are also using the wrong ip range for SSM 

Address Range: SSM operates in the 232/8 ip range (232.0.0.1 to 232.255.255.255)

Windows/Network Prerequisites

    Network Support: Routers must support IGMPv3 and PIM-SSM.
    Windows IGMPv3: Ensure the network interface is configured to use IGMPv3.
    Firewall: Windows Firewall must allow incoming UDP traffic on the specified port.
    TTL: Set a TTL higher than 1 if passing through routers.


Also can you show me the complete console output?
